{
  "$schema": "https://json-schema.org/draft/2020-12/schema",
  "$id": "https://hachi-hashi.local/contracts/envelope.v1.schema.json",
  "title": "Envoltura común de eventos de Hachi Hashi",
  "type": "object",
  "required": [
    "messageId",
    "type",
    "version",
    "occurredAt",
    "source",
    "correlationId",
    "causationId",
    "payload"
  ],
  "properties": {
    "messageId": { "type": "string", "format": "uuid" },
    "type": { "type": "string", "minLength": 1 },
    "version": { "type": "integer", "minimum": 1 },
    "occurredAt": { "type": "string", "format": "date-time" },
    "source": { "type": "string", "minLength": 1 },
    "correlationId": { "type": "string", "format": "uuid" },
    "causationId": {
      "oneOf": [{ "type": "string", "format": "uuid" }, { "type": "null" }]
    },
    "payload": { "type": "object" }
  },
  "additionalProperties": true
}
