[
  {
    "messageId": "7c1f0e52-3b8a-4f6e-9d2a-5a1b6c0d9e11",
    "type": "MenuItemUpdated",
    "version": 1,
    "occurredAt": "2026-10-20T18:42:10Z",
    "source": "menu",
    "correlationId": "0b6f2a9e-41c5-4c0e-8f3a-2d7e9b1a5c33",
    "causationId": null,
    "payload": {
      "menuItemId": "3f9a6d2e-8c14-4b7a-a5e0-91d2c7b84f10",
      "revision": 4,
      "name": "Nigiri de salmón",
      "priceCents": 18900,
      "currency": "MXN",
      "categoryId": "b2d4e6f8-1a3c-4e5b-9d7f-0c2a4e6b8d10",
      "categoryName": "Nigiri",
      "active": true
    }
  }
]
